{
  "artifact_type": "packaged_deployment_approval_evidence_packet",
  "packet_id": "packaged-deployment-approval:reference:2026-05-21",
  "generated_at": "2026-05-21T09:00:00Z",
  "claim_mode": "reference_drill",
  "deployment_artifact": {
    "artifact_id": "qrtrust-reference-bundle",
    "version": "2026.05.21-reference",
    "artifact_ref": "docs/public/network-contracts/examples/deployment-readiness-bundle-reference.json",
    "sha256": "e3b0c44298fc1c149afbf4c8996fb92427ae41e4649b934ca495991b7852b855",
    "created_at": "2026-05-21T09:00:00Z"
  },
  "environment": {
    "environment_id": "local-reference-lab",
    "stage": "reference_lab",
    "owner": "QR Trust reference operator",
    "boundary_ref": "docs/public/network-contracts/deployment-readiness-operator-guide.md#environment-boundary"
  },
  "gates": [
    {
      "gate_id": "artifact_fingerprinted",
      "status": "passed",
      "evidence_ref": "docs/public/network-contracts/examples/deployment-readiness-bundle-reference.json",
      "checked_at": "2026-05-21T09:00:00Z",
      "summary": "Reference bundle includes stable file-role fingerprints."
    },
    {
      "gate_id": "contract_smoke_passed",
      "status": "passed",
      "evidence_ref": "network/src/programs/deployment-readiness-bundle-smoke.ts",
      "checked_at": "2026-05-21T09:00:00Z",
      "summary": "Contract smoke path validates bundle role coverage."
    },
    {
      "gate_id": "operator_approval_recorded",
      "status": "passed",
      "evidence_ref": "docs/public/network-contracts/deployment-readiness-operator-guide.md#approval-boundary",
      "checked_at": "2026-05-21T09:00:00Z",
      "summary": "Approval is represented as an evidence reference, not a public secret."
    },
    {
      "gate_id": "rollback_plan_accepted",
      "status": "passed",
      "evidence_ref": "docs/public/network-contracts/restore-automation-evidence.md",
      "checked_at": "2026-05-21T09:00:00Z",
      "summary": "Rollback acceptance points at the restore-automation evidence packet."
    }
  ],
  "approvals": [
    {
      "role": "release_owner",
      "approver": "Reference release owner",
      "decision": "approved",
      "approval_ref": "docs/public/network-contracts/deployment-readiness-operator-guide.md#release-owner",
      "approved_at": "2026-05-21T09:00:00Z",
      "scope": "Reference packaged deployment packet shape."
    },
    {
      "role": "security_reviewer",
      "approver": "Reference security reviewer",
      "decision": "approved",
      "approval_ref": "docs/public/network-contracts/managed-signing-custody-deployment-policy.md#review-boundary",
      "approved_at": "2026-05-21T09:00:00Z",
      "scope": "Public-safe boundary and custody separation."
    },
    {
      "role": "operations_reviewer",
      "approver": "Reference operations reviewer",
      "decision": "approved",
      "approval_ref": "docs/public/network-contracts/worker-operations-evidence.md",
      "approved_at": "2026-05-21T09:00:00Z",
      "scope": "Worker, restore, and operator handoff readiness."
    }
  ],
  "rollback_plan": {
    "plan_ref": "docs/public/network-contracts/restore-automation-evidence.md#rollback-and-restore-boundary",
    "rehearsal_ref": "docs/public/network-contracts/examples/restore-automation-evidence-reference.json",
    "owner": "QR Trust reference operator",
    "accepted_at": "2026-05-21T09:00:00Z"
  },
  "guardrails": {
    "public_repo_contains_no_secrets": true,
    "operator_controls_remain_external": true,
    "rollback_plan_required": true,
    "production_approval_requires_ops_refs": true
  },
  "reviewer": {
    "name": "QR Trust reference maintainer",
    "role": "contract reviewer",
    "reviewed_at": "2026-05-21"
  }
}
